Book Id,Title,Author,Author l-f,Additional Authors,ISBN,ISBN13,My Rating,Average Rating,Publisher,Binding,Number of Pages,Year Published,Original Publication Year,Date Read,Date Added,Bookshelves,Bookshelves with positions,Exclusive Shelf,My Review,Spoiler,Private Notes,Read Count,Owned Copies,Used ISBN,Genre
214331246,"Sunrise on the Reaping (The Hunger Games, #0.5)",Suzanne Collins,"Collins, Suzanne",,1546171460,9781546171461,0,4.6,Scholastic Press,Hardcover,400.0,2025.0,2025.0,,2025/02/13,to-read,to-read (#268),to-read,,,,0,0,9781546171461,No categories available
136470356,Nocticadia,Keri Lake,"Lake, Keri",,,,0,4.24,,Kindle Edition,682.0,2023.0,2023.0,,2025/02/11,to-read,to-read (#267),to-read,,,,0,0,,No ISBN
212808709,Deep End,Ali Hazelwood,"Hazelwood, Ali",,,,5,4.07,Berkley,Kindle Edition,464.0,2025.0,2025.0,2025/02/10,2025/02/10,,,read,"Read this on a whim for a flight. I wasn't planning on reading this book because I had given up on Ali Hazelwood. I loved The Love Hypothesis, but then I really disliked the steminist novels that she put out because I felt like they were recycled and then I never picked up another one of her books. But, I was inspired to pick this one up, because I was a swimmer for 15 years of my life and I'm glad I did! <br/><br/>I really loved this book, with the emphasis on mental health and how that can affect Scarlett's diving. I also liked how they explored the dom/sub stuff with the acknowledgment on feminism and the control it brings. I'm not typically a fan of that stuff, but I liked how it was represented with the constant check ins from Luk, it felt caring and consensual which sometimes other books lack. <br/><br/>Loved this one! I think it's bringing me out of my reading slump. (I haven't read a book in 3 months) ",,,1,0,,No ISBN
58890783,Either/Or,Elif Batuman,"Batuman, Elif",,0525557598,9780525557593,4,3.99,Penguin Press,Hardcover,368.0,2022.0,2022.0,2025/02/06,2023/06/15,,,read,"Going into this book I did not know it was a sequel. It doesn't even say that it is on Goodreads. I didn't realize that until I was about a quarter of the way through and was confused why they were throwing all these characters at us, as if we were supposed to know them already. (Turns out we were supposed to know them already lmao) Even without the background, I think I have a good understanding of how the first book ended up going, with her current obsession with Ivan. <br/><br/>I thought this was a really interesting book with a very unique main character who was both relatable and unrelatable. Clearly Selin was incredibly smart, but lack the social understanding of lots of things. I probably didn't understand as much of the book as I would've liked, since I have no knowledge of any of the Russian literature that was referenced in the novel, but I still enjoyed it.",,,1,0,9780525557593,"education, coming of age, love, personal development, Women college students, Fiction, Identity (Psychology), Turkish Americans, FICTION / Literary, FICTION / Coming of Age, FICTION / Women, FICTION / Diversity & Multicultural"
210223811,Katabasis,R.F. Kuang,"Kuang, R.F.",,,,0,4.39,HarperVoyager,Kindle Edition,,2025.0,2025.0,,2025/02/05,to-read,to-read (#266),to-read,,,,0,0,,No ISBN
201627074,Not Another Love Song,Julie  Soto,"Soto, Julie",,1538740915,9781538740910,0,4.08,Forever,Paperback,384.0,2024.0,2024.0,,2025/01/29,to-read,to-read (#265),to-read,,,,0,0,9781538740910,No categories available
62926938,The Seven Year Slip,Ashley Poston,"Poston, Ashley",,,,0,4.19,Berkley,Paperback,336.0,2023.0,2023.0,,2025/01/29,to-read,to-read (#264),to-read,,,,0,0,,No ISBN
6514,The Bell Jar,Sylvia Plath,"Plath, Sylvia",,0571268862,9780571268863,0,4.06,Harper Perennial Modern Classics,Paperback,294.0,2006.0,1963.0,,2022/09/28,,,read,,,,1,0,9780571268863,"women college students, summer, Classics, Literature, Psychology, Feminism, Novel, Poetry, Mental Health, American, Adult, Fiction, Mental Depression, Suicidal behavior, Mentally ill, Psychiatric hospital patients, Mental illness, Women authors, Treatment, Women periodical editors, College students, Suicide, Psychological fiction, Autobiographical fiction, Roman à clef, open_syllabus_project, Women psychotherapy patients, Fiction, psychological, American fiction (fictional works by one author), Young women, fiction, Students, fiction, Children's fiction, Depression, mental, fiction, Fiction, biographical, Fiction, general, New york (n.y.), fiction, American literature, Interns, Women's periodicals, Electroconvulsive therapy, Sexism, Depression in women, Authors"
56616095,The Bell Jar,Sylvia Plath,"Plath, Sylvia","Frances McCullough, Lois Ames",0060837020,9780060837020,0,4.06,Harper Perennial,Paperback,288.0,2006.0,1963.0,,2025/01/25,,,read,,,,1,0,9780060837020,"women college students, summer, Classics, Literature, Psychology, Feminism, Novel, Poetry, Mental Health, American, Adult, Fiction, Mental Depression, Suicidal behavior, Mentally ill, Psychiatric hospital patients, Mental illness, Women authors, Treatment, Women periodical editors, College students, Suicide, Psychological fiction, Autobiographical fiction, Roman à clef, open_syllabus_project, Women psychotherapy patients, Fiction, psychological, American fiction (fictional works by one author), Young women, fiction, Students, fiction, Children's fiction, Depression, mental, fiction, Fiction, biographical, Fiction, general, New york (n.y.), fiction, American literature, Interns, Women's periodicals, Electroconvulsive therapy, Sexism, Depression in women, Authors"
219848373,"The Irresistible Urge to Fall for Your Enemy (Dearly Beloathed, #1)",Brigitte Knightley,"Knightley, Brigitte",,0593819454,9780593819456,0,4.44,Ace,Hardcover,384.0,2025.0,2025.0,,2025/01/23,to-read,to-read (#263),to-read,,,,0,0,9780593819456,American literature
61374793,I Am Not Jessica Chen,Ann Liang,"Liang, Ann",,133552312X,9781335523129,0,4.14,HarperTeen,Hardcover,320.0,2025.0,2025.0,,2025/01/22,to-read,to-read (#262),to-read,,,,0,0,9781335523129,Not Found
207670238,Alchemised,SenLinYu,"SenLinYu, SenLinYu",,,,0,4.68,Del Rey Books,Hardcover,976.0,2025.0,2025.0,,2024/12/06,to-read,to-read (#261),to-read,,,,0,0,,No ISBN
60556912,"The Housemaid (The Housemaid, #1)",Freida McFadden,"McFadden, Freida",,1803144378,9781803144375,4,4.31,Bookouture,Kindle Edition,329.0,2022.0,2022.0,2024/12/02,2024/12/02,,,read,"My second Freida McFadden book (I read The Boyfriend first). It was engaging and I read the book in about 2 hours. I liked the twist, but I felt like it was missing just a little bit. ",,,1,0,9781803144375,Not Found
60435878,Carrie Soto Is Back,Taylor Jenkins Reid,"Reid, Taylor Jenkins",,0593158687,9780593158685,0,4.21,Ballantine Books,Hardcover,384.0,2022.0,2022.0,,2024/12/01,to-read,to-read (#260),to-read,,,,0,0,9780593158685,"American literature, nyt:combined-print-and-e-book-fiction=2022-09-18, New York Times bestseller, Fiction, women, Fiction, sports, Fiction, romance, sports"
59364173,I'm Glad My Mom Died,Jennette McCurdy,"McCurdy, Jennette",,,,5,4.45,Simon & Schuster,ebook,320.0,2022.0,2022.0,2024/09/01,2022/08/09,,,read,Read this so quickly. <br/><br/>Since this book has been out for a while I had heard some excerpts but it didn't prepare me for the hell that Jennette McCurdy survived. <br/><br/>Nobody should have to go through what she went through. Knowing that I was watching her on iCarly when it was coming out and didn't know any of this was happening goes to show that you never know what's happening in a celebrity's life. They are not good role models.,,,1,0,,No ISBN
63291997,"With a Little Luck (Fortuna Beach, #2)",Marissa Meyer,"Meyer, Marissa",Chuck Gonzales,1250618932,9781250618931,3,3.85,Feiwel & Friends,Hardcover,360.0,2024.0,2024.0,2024/12/01,2023/10/25,,,read,"A wonderful addition to Instant Karma, though I didn't enjoy it as much. It was still a fun read! The ""twist"" was seen from a mile away. ",,,1,0,9781250618931,"nyt:young-adult-hardcover=2024-03-03, New York Times bestseller"
217245608,What Happens in Amsterdam,Rachel Lynn Solomon,"Solomon, Rachel Lynn",,0593548558,9780593548554,0,4.15,Berkley,Paperback,384.0,2025.0,2025.0,,2024/12/01,to-read,to-read (#259),to-read,,,,0,0,9780593548554,Not Found
57773248,Notes on an Execution,Danya Kukafka,"Kukafka, Danya",,0063052733,9780063052734,0,4.06,William Morrow,Hardcover,306.0,2022.0,2022.0,,2024/11/29,to-read,to-read (#258),to-read,,,,0,0,9780063052734,"Serial murderers, Fiction, Family, Friends and associates, Death row inmates, Tueurs en série, Romans, nouvelles, Famille, Amis et relations, Condamnés à mort, FICTION / Thrillers / Psychological, FICTION / Crime, FICTION / Women, Murderers"
204538483,"The Striker (Gods of the Game, #1)",Ana Huang,"Huang, Ana",,,,4,3.78,,Kindle Edition,595.0,2024.0,2024.0,2024/11/22,2024/11/22,,,read,"I don't typically like sports romance, but I am a dedicated Ana Huang fan so I had to at least try. Honestly, I was surprised at how much I enjoyed this. I liked it more than the King of Pride and King of Sloth. (But I also don't love the billionaire romances either haha) <br/><br/>This book is def Ana Huang. Follows the exact same type of story line with the 3rd act betrayal. Usually the 3rd act betrayal and how much of a betrayal determines my liking of the book. I don't like Asher. LOL. I'm not sure I would've forgiven him.  ",,,1,0,,No ISBN
209753199,"The Irresistible Urge to Fall For Your Enemy (Dearly Beloathed, #1)",Brigitte Knightley,"Knightley, Brigitte",,0356524736,9780356524733,0,4.44,Orbit Books,Hardcover,416.0,2025.0,2025.0,,2024/11/21,to-read,to-read (#257),to-read,,,,0,0,9780356524733,American literature
215109788,"Rose in Chains (The Evermore Trilogy, #1)",Julie  Soto,"Soto, Julie",,0008711690,9780008711696,0,4.53,Magpie,Kindle Edition,0.0,2025.0,2025.0,,2024/11/21,to-read,to-read (#256),to-read,,,,0,0,9780008711696,Not Found
150260787,"Ruthless Vows (Letters of Enchantment, #2)",Rebecca   Ross,"Ross, Rebecca",,,,3,4.01,Wednesday Books,Kindle Edition,419.0,2023.0,2023.0,2024/11/15,2024/03/01,,,read,,,,1,0,,No ISBN
158649729,All in Her Head: The Truth and Lies Early Medicine Taught Us About Women's Bodies and Why It Matters Today,Elizabeth Comen,"Comen, Elizabeth",,0063293013,9780063293014,0,4.38,Harper Wave,Hardcover,368.0,2024.0,2024.0,,2024/11/11,to-read,to-read (#255),to-read,,,,0,0,9780063293014,No categories available
8031168,"Delusions of Gender: How Our Minds, Society, and Neurosexism Create Difference",Cordelia Fine,"Fine, Cordelia",,0393068382,9780393068382,0,4.08,W.W. Norton & Company,Hardcover,338.0,2010.0,2010.0,,2024/11/05,to-read,to-read (#254),to-read,,,,0,0,9780393068382,"Neuropsychology, Sex Factors, Brain, Sex differences (Psychology), Sex differences, Physiology, Hjärna, Geschlechtsunterschied, Frau, Könsskillnader, Gehirn, Geschlechterforschung, Sex, Social aspects"
320481,Are Women Human? Astute and Witty Essays on the Role of Women in Society,Dorothy L. Sayers,"Sayers, Dorothy L.",,0802829961,9780802829962,0,4.46,William B. Eerdmans Publishing Company,Paperback,75.0,2005.0,1970.0,,2024/11/05,to-read,to-read (#253),to-read,,,,0,0,9780802829962,"History, Women, Conditions sociales, Modern period, Femmes, Women, history, modern period, 1600-, Women, social conditions, Essays (single author), Women, history"
53285047,"Bunny (Bunny, #1)",Mona Awad,"Awad, Mona",,0525559752,9780525559757,0,3.48,Penguin Books,Paperback,305.0,2020.0,2019.0,,2024/10/29,to-read,to-read (#252),to-read,,,,0,0,9780525559757,"American literature, Fiction, general, Graduate students, Fiction, FICTION / Literary, FICTION / Fairy Tales, Folk Tales, Legends & Mythology, FICTION / Humorous / Black Humor"
44279110,My Year of Rest and Relaxation,Ottessa Moshfegh,"Moshfegh, Ottessa",,0525522131,9780525522133,4,3.62,Penguin Books,Paperback,289.0,2019.0,2018.0,2024/10/29,2024/10/17,,,read,I enjoyed this book. It was interesting to read about depression in this manor. <br/><br/><spoiler> I liked how there is no redemption for anyone. </spoiler>,,,1,0,9780525522133,"Fiction, Solitude, American Psychological fiction, Medication abuse, Quacks and quackery, Young women, New york (n.y.), fiction, Fiction, women, nyt:hardcover-fiction=2018-07-29, New York Times bestseller, New York Times reviewed, Psychological fiction, Literary, Contemporary Women"
75491526,"King of Sloth (Kings of Sin, #4)",Ana Huang,"Huang, Ana",,,,3,4.0,,Kindle Edition,466.0,2024.0,2024.0,2024/10/29,2024/08/07,,,read,My least favorite Ana Huang book I've read. <br/><br/>I didn't like Xavier and I didn't like Sloane. <br/><br/>Massive oh boo hoo on this one. Just get over yourself. ,,,1,0,,No ISBN
215805924,"Vera Wong's Guide to Snooping [on a Dead Man] (Vera Wong, #2)",Jesse Q. Sutanto,"Sutanto, Jesse Q.",,0593546253,9780593546253,0,4.33,Berkley,Paperback,336.0,2025.0,2025.0,,2024/10/09,to-read,to-read (#251),to-read,,,,0,0,9780593546253,English literature
26856502,"Vengeful (Villains, #2)",Victoria E. Schwab,"Schwab, Victoria E.",,,,5,4.13,Tor,Kindle Edition,462.0,2018.0,2018.0,2021/06/28,2021/06/27,,,read,"Edit October 2024: <br/>So I just did a reread of the two Villains books in the past couple months and I had totally forgotten what happened in this book! Rereading my old review everything is still true. Except now we know that there will be a third one! <br/><br/>OG Review June 2021:<br/>Wow this was a whirlwind. I am in love with Victor Vale and it isn't surprising. He's such a fascinating character and impossible not to love. I found out recently that there is possibly a third book in this Villians world and you better believe I will be the first person to pre-order that book when it comes out. <br/><br/>I love that we were able to find out so much more about Eli's history and backstory and I thought that Marella's character was so fascinating. <br/><br/><spoiler> I think I'm in shock and denial that Eli died. I really wanted it to be a battle of wit and have Victor figure something out and kill Eli but it happened to be that crazy scientist instead. And the scientist, I can't even remember his name was so insignificant it almost seems unfair. But I really like that Sydney was the one who pulled the trigger to finish Eli off since Victor wasn't the one able to do it. <br/><br/>I'm sad that Victor kinda left Sydney and Mitch in the dust and walked away. I think that Sydney must be the key to saving him since she was the one who revived him in the first place. Like maybe they kill Victor and Sydney can bring him back fixed. <br/><br/>Also I've always wondered what would happen if Eli was decapitated. Does his head grow a new body, or does his body grow a new head. That would've been interesting to explore. </spoiler> <br/><br/>I love this book so much! This Villians universe is definitely one of my favorites.",,,2,0,,No ISBN
203956639,An Academy for Liars,Alexis Henderson,"Henderson, Alexis",,0593638301,9780593638309,0,3.48,Ace,Hardcover,464.0,2024.0,2024.0,,2024/09/16,to-read,to-read (#250),to-read,,,,0,0,9780593638309,No categories available
17573685,The Feminine Mystique,Betty Friedan,"Friedan, Betty","Gail Collins, Anna Quindlen",0393346781,9780393346787,0,3.87,W. W. Norton & Company,Paperback,562.0,2013.0,1963.0,,2024/09/13,to-read,to-read (#249),to-read,,,,0,0,9780393346787,"Femmes, Conditions sociales, Discrimination à l'égard des femmes, Histoire et Condition Sociale, Droits, Women, Social conditions, Psychology, Feminism, Social and moral questions, Vrouwen, Sociale situatie, open_syllabus_project, Long Now Manual for Civilization, Frauenemanzipation, Geschlechterrolle, Umschulungswerkstätten für Siedler und Auswanderer, Frau, Psychologie, Féminisme, Women's rights, Women's studies, Women, social conditions, Women, united states, social conditions, Women, psychology, Condiciones sociales, Women in the United States, Mujeres, Problemas sociales y morales, United states, social conditions, 1945-, Friedan, betty, 1921-2006"
57004637,The Book of Form and Emptiness,Ruth Ozeki,"Ozeki, Ruth",,0399563644,9780399563645,0,4.02,Viking,Hardcover,548.0,2021.0,2021.0,,2024/09/07,to-read,to-read (#248),to-read,,,,0,0,9780399563645,"American literature, Fiction, magical realism, Fiction, coming of age, Teenage boys, Fiction, Fathers, Death, Books, Public libraries, Compulsive hoarding, Asian Americans, Bildungsromans, FICTION / Asian American, FICTION / Coming of Age, FICTION / Magical Realism, Coming of age"
217206738,"King of Wrath (Kings of Sin, #1)",Ana Huang,"Huang, Ana",,,,4,4.05,,Kindle Edition,398.0,2022.0,2022.0,2024/02/11,2024/08/07,,,read,Honestly my favorite spicy scenes and male character compared to the whole twisted series! <br/><br/>Merged review:<br/><br/>Honestly my favorite spicy scenes and male character compared to the whole twisted series! <br/><br/>Merged review:<br/><br/>Honestly my favorite spicy scenes and male character compared to the whole twisted series! <br/><br/>Merged review:<br/><br/>Honestly my favorite spicy scenes and male character compared to the whole twisted series! <br/><br/>Merged review:<br/><br/>Honestly my favorite spicy scenes and male character compared to the whole twisted series! <br/><br/>Merged review:<br/><br/>Honestly my favorite spicy scenes and male character compared to the whole twisted series! <br/><br/>Merged review:<br/><br/>Honestly my favorite spicy scenes and male character compared to the whole twisted series! <br/><br/>Merged review:<br/><br/>Honestly my favorite spicy scenes and male character compared to the whole twisted series! <br/><br/>Merged review:<br/><br/>Honestly my favorite spicy scenes and male character compared to the whole twisted series! <br/><br/>Merged review:<br/><br/>Honestly my favorite spicy scenes and male character compared to the whole twisted series! <br/><br/>Merged review:<br/><br/>Honestly my favorite spicy scenes and male character compared to the whole twisted series! <br/><br/>Merged review:<br/><br/>Honestly my favorite spicy scenes and male character compared to the whole twisted series! <br/><br/>Merged review:<br/><br/>Honestly my favorite spicy scenes and male character compared to the whole twisted series!,,,3,0,,No ISBN
215806352,"Vera Wong's Guide to Snooping on a Dead Man (Vera Wong, #2)",Jesse Q. Sutanto,"Sutanto, Jesse Q.",,0593546261,9780593546260,0,4.33,Berkley,Kindle Edition,,2025.0,2025.0,,2024/08/07,to-read,to-read (#247),to-read,,,,0,0,9780593546260,Not Found
176442577,"Murder Your Employer (The McMasters Guide to Homicide, #1)",Rupert Holmes,"Holmes, Rupert",,1451648227,9781451648225,0,3.82,Avid Reader Press,Paperback,395.0,2024.0,2023.0,,2024/08/07,to-read,to-read (#246),to-read,,,,0,0,9781451648225,"nyt:combined-print-and-e-book-fiction=2024-05-19, New York Times bestseller"
61827543,"Vera Wong's Unsolicited Advice for Murderers (Vera Wong, #1)",Jesse Q. Sutanto,"Sutanto, Jesse Q.",,0593549228,9780593549223,4,4.03,Berkley,Paperback,339.0,2023.0,2023.0,2024/08/07,2023/11/14,,,read,"This book was so wonderful and whimsical. I've never read anything like it. Vera Wong was such a classic Chinese grandmother. Having the setting in SF with all these characters felt so realistic even if the situation itself was so unrealistic. <br/><br/>Vera's personality really shined through and I see that this book is a series and I would be very interested in continuing to read, though, can Vera just relax and enjoy retirement ;-;",,,1,0,9780593549223,No categories available
58659343,Our Wives Under the Sea,Julia Armfield,"Armfield, Julia",,152901722X,9781529017229,0,3.75,Picador,Paperback,240.0,2022.0,2022.0,,2024/07/10,to-read,to-read (#245),to-read,,,,0,0,9781529017229,"Lesbian couples, Fiction, Women marine biologists, Grief, Wives, Same-sex marriage, Underwater exploration, FICTION / LGBTQ+ / General, Submarines, Lesbians, Life change events"
58109575,"London Dynasty (The Dynasties, #1)",Geneva Lee,"Lee, Geneva",,,,3,4.11,Estate Publishing,Kindle Edition,160.0,2021.0,2020.0,2024/06/19,2024/06/19,,,read,This was sooooo funny. Lmao it's not that good at all but i might continue reading for the vibes,,,1,0,,No ISBN
199310463,"Past Present Future (Rowan & Neil, #2)",Rachel Lynn Solomon,"Solomon, Rachel Lynn",,1665901950,9781665901956,5,3.88,Simon & Schuster Books for Young Readers,Hardcover,384.0,2024.0,2024.0,2024/01/01,2024/02/16,,,read,,,,1,0,9781665901956,No categories available
44334073,Tools and Weapons: The Promise and the Peril of the Digital Age,Brad   Smith,"Smith, Brad",Carol Ann  Browne,1984877712,9781984877710,3,3.86,Penguin Press,Hardcover,368.0,2019.0,2019.0,2024/06/19,2024/03/26,,,read,Read this for class but it lowkey was a microsoft circle jerk,,,1,0,9781984877710,"nyt:hardcover-nonfiction=2019-09-29, New York Times bestseller, Cyberspace, Digital electronics, Computer crimes, Computers, social aspects, Computer science, Social aspects, Moral and ethical aspects"
62695377,"Threads That Bind (Threads That Bind, #1)",Kika Hatzopoulou,"Hatzopoulou, Kika",,0593528719,9780593528716,0,3.91,Razorbill,Hardcover,352.0,2023.0,2023.0,,2024/05/11,to-read,to-read (#244),to-read,,,,0,0,9780593528716,No categories available
23437156,"Six of Crows (Six of Crows, #1)",Leigh Bardugo,"Bardugo, Leigh",,1627792120,9781627792127,5,4.47,Henry Holt & Company,Hardcover,480.0,2015.0,2015.0,2017/04/16,2015/11/10,,,read,"WOW! <br/><br/>This book is what I have been looking for for ages. <br/><br/>I love Kaz and Inej, they're my favorite characters.  <br/><br/>Also, actual badass characters who kill.  Not fake assassins or criminal YA characters who are afraid of killing when it needs to be done.  Real Killers.  YESSSSSSSSSSSSSSS<br/><br/>Edit April 15, 2021: <br/><br/>Wow, my fourth reread of Six Of Crows. Every time it blows me away. I thought, maybe I could give this book a proper review. (Though none of my reviews are ever proper)<br/><br/>This is hands down my favorite book of all time. Yes. My favorite book of all time. <br/>I'm rereading it now for the Shadow and Bone TV show coming out on April 23, 2021. <br/><br/>Once again, I'm shocked by how beautiful Bardugo's writing is. The way it flows and melds together is beautiful. Every single word keeps my eyes glued to the page. Even though it's my fourth time reading it, it always feels like it's my first.  <br/><br/>Kaz  Brekker is  the ultimate guy. He's dark and brooding and insane, but somehow realistic. I love how Bardugo creates these characters that are so strong and powerful, but all of them have incredibly deep flaws that keep them grounded. I'll never get tired of this book. Never. It's amazing and I'm so glad to have read it.<br/><br/>Edit May 7, 2024:<br/>This is my 5th time reading this book because I bought the special LitJoy Crate edition with annotations written by Bardugo herself. I loved reading this because it allowed me to see all her background thoughts of a lot of scenes. ",,,5,0,9781627792127,"Young adult fiction, Fantasy fiction, Fiction, Young adult works, Juvenile works, Science fiction, Juvenile fiction, LGBTQ novels, YA fiction, mystery, heist, fantasy, Brigands and robbers, Thriller, Action & Adventure, Imaginary places, Magic, Gangs, Children's fiction, Robbers and outlaws, fiction, nyt:young-adult-e-book=2015-10-18, New York Times bestseller"
194802722,Funny Story,Emily Henry,"Henry, Emily",,,,4,4.22,Berkley,Kindle Edition,400.0,2024.0,2024.0,2024/05/04,2024/04/30,,,read,"I had high expectations going into this book because Emily Henry is one of my favorite authors. Also, I'm going to be a Librarian so I felt very connected to the FMC. The past three books she's written I have loved. This felt like the weakest of hers so far. <br/><br/>The thing was, I'm not sure I've related to another FMC more. Same occupation, same anxieties, same trauma. Her thoughts and fears echoed mine exactly. But I just didn't like Miles all too much so maybe that is where my disconnect was. Still a great book, and I'll definitely read her next one. ",,,1,0,,No ISBN
40874032,"Vicious (Villains, #1)",Victoria E. Schwab,"Schwab, Victoria E.",,,,5,4.2,Tor Books,Kindle Edition,402.0,2013.0,2013.0,2021/06/27,2021/06/27,,,read,I love how V.E. Schwab tells her stories weaving back and forth between the past and the present. Filling in gaps in such an artistic way keeping my eyes glued to the page. (Of course I don't know if that's always her MO since this is only the second book I've read of hers. The first being the Invisible Life Of Addie LaRue.) <br/><br/>I love Victor's character! I like how he's so morally gray and so fixed on his revenge. I like the world she created with EOs and Sydney's character was so great too. <br/><br/>I'm so lucky that I get to now read the sequel and do not have to wait 5 years to read it like the original people who read this book. <br/><br/>I can't wait to see what Victor Vale is up to next! ,,,1,0,,No ISBN
