Book Id,Title,Author,Author l-f,Additional Authors,ISBN,ISBN13,My Rating,Average Rating,Publisher,Binding,Number of Pages,Year Published,Original Publication Year,Date Read,Date Added,Bookshelves,Bookshelves with positions,Exclusive Shelf,My Review,Spoiler,Private Notes,Read Count,Owned Copies,Used ISBN,Genre
13485199,"Death Bringer (Skulduggery Pleasant, #6)",Derek Landy,"Landy, Derek",,0007326033,9780007326037,5,4.47,Harpercollins UK,Paperback,603.0,2012.0,2011.0,2015/05/30,2015/05/26,,,read,"This series has officially taken over my life.  I cried once actually during this book.  Tears were streaming down my face, and it can't be a coincidence that a slow and sad song was playing at the same time which totally matched what I was reading.  I think that the author got a little carried away with a sort of twilight feel when Valkyrie cheated of Fletcher with Caelan .  But even though she was stupid and broke up with Fletcher, it all worked out in the end when she killed the vampire.  I was actually kind of sad because I felt there was so much potential for his character when we first met him, but I guess he wasn't important to the plot.  I would most definitely start the next book right now if I didn't have school projects and homework to be done.  But I will read as soon as I can!! SO EXCITED!",True,,2,0,9780007326037,"Children's fiction, Wizards, fiction, Skulduggery Pleasant (Fictitious character), Stephanie (Fictitious character : Landy), Juvenile fiction, Fantasy, Magic, Fiction, Fantasy fiction, Child and youth fiction"
8113344,"Mortal Coil (Skulduggery Pleasant, #5)",Derek Landy,"Landy, Derek",,0007325983,9780007325986,5,4.45,HarperCollins Children's Books,Hardcover,604.0,2010.0,2010.0,2015/05/26,2015/05/25,,,read,"OMG this book wow!  I totally ship Fletcher and Valkyrie! and the whole Darquess this!!! This book is five stars and I know that the rest of them will be even better, how I do not know, but I am super pumped.  So glad I bought the whole series at once other wise I would be waiting for the next one to ship in! anyway this series is fabulous!!!",,,2,0,9780007325986,"Skulduggery Pleasant (Fictitious character), Wizards, Magic, Juvenile fiction, Children's fiction, Wizards, fiction, Magic, fiction, Fantasy fiction, Fiction, Teen fantasy fiction"
7261549,"Dark Days (Skulduggery Pleasant, #4)",Derek Landy,"Landy, Derek",,0007325940,9780007325948,5,4.42,Harper Collins Children's,Hardcover,415.0,2010.0,2010.0,2015/05/21,2015/05/21,,,read,"First in The Faceless Ones there is that cliffhanger where Skulduggery is sucked into that other dimension! And now this book has an equally awesome/why?!?!?!?! ending.  <br/><br/>These books keep getting better and better and I freaking love them.  Next book, here I come!",,,2,0,9780007325948,"Detectives, Detective and mystery stories, Juvenile fiction, Bien y mal, Fiction, Novela juvenil, Spanish language materials, Wizards, Hechiceros, Good and evil, Children's fiction, Wizards, fiction, Fantasy fiction, Skulduggery Pleasant (Fictitious character), Valkyrie Cain (Fictitious character), Magic, Child and youth fiction, Magic, fiction"
4893390,"The Faceless Ones (Skulduggery Pleasant, #3)",Derek Landy,"Landy, Derek",,0007302142,9780007302147,5,4.4,HarperCollins Children's Books,Hardcover,395.0,2009.0,2008.0,2015/05/12,2015/05/11,,,read,"OMG I love this series and this was the best one so far.  All the action and suspense, wow.  I can't believe that cliffhanger though, when Skulduggery fell into the hole.  I know they are going to get him out eventually, but this really means that Valkyrie is really going to have to do things on her own and not rely on Skulduggery any more.  I cannot wait to get my hands on the next book!",True,,2,0,9780007302147,"Fantasy, Magic, Fiction, Juvenile Fiction, Mystery, Children's fiction, Magic, fiction, Fantasy fiction, Wizards, fiction, Skulduggery Pleasant (Fictitious character), Adventure and adventurers, Stephanie (Fictitious character : Landy), Dead, Wizards, Inheritance and succession, Good and evil, Magician detectives, Child and youth fiction, Science fiction, fantasy, horror"
2157243,"Playing with Fire (Skulduggery Pleasant, #2)",Derek Landy,"Landy, Derek",,0061240885,9780061240881,4,4.29,HarperCollins,Hardcover,389.0,2008.0,2008.0,2015/05/05,2015/05/05,,,read,"The book started off a little slow, but near the end, I could not put the book down.  I highly recommend this book, although I think it is a little violent for younger readers in some parts.  I thought that this book was slightly better than the first one and cannot wait to continue reading this series.",,,2,0,9780061240881,"Fantasy, Fiction, Juvenile fiction, Magic, Mystery, Fantasy fiction, Children's fiction, Magic, fiction, Wizards, fiction, Ficción juvenil, Magia, Spanish language materials, Fantasía, Mysterier, Barn- och ungdomslitteratur, Fire, fiction"
51901147,"The Ballad of Songbirds and Snakes (The Hunger Games, #0)",Suzanne Collins,"Collins, Suzanne",,,,0,3.98,Scholastic Press,Kindle Edition,541.0,2020.0,2020.0,,2020/07/03,to-read,to-read (#80),to-read,,,,0,0,,No ISBN
23302416,"Wonder (Wonder, #1)",R.J. Palacio,"Palacio, R.J.",Raquel Jaramillo,,,3,4.36,Corgi Childrens,Paperback,318.0,2013.0,2012.0,,2014/12/28,,,read,,,,1,0,,No ISBN
40142464,You Owe Me a Murder,Eileen Cook,"Cook, Eileen",,1328519023,9781328519023,0,3.54,Clarion Books,Hardcover,368.0,2019.0,2019.0,,2019/12/12,to-read,to-read (#79),to-read,,,,0,0,9781328519023,"Children's fiction, Murder, fiction, Friendship, fiction, Dating (social customs), fiction, Mystery and detective stories, London (england), fiction"
41150615,The Severed Moon: A Year-Long Journal of Magic,Leigh Bardugo,"Bardugo, Leigh",,1250207746,9781250207746,0,4.32,Imprint,Hardcover,368.0,2019.0,2019.0,,2019/10/21,to-read,to-read (#78),to-read,,,,0,0,9781250207746,No categories available
43263680,"Ninth House (Alex Stern, #1)",Leigh Bardugo,"Bardugo, Leigh",,1250313074,9781250313072,0,4.01,Flatiron Books,Hardcover,461.0,2019.0,2019.0,,2019/10/15,to-read,to-read (#77),to-read,,,,0,0,9781250313072,"Dark Fantasy, Fiction, thrillers, general, Fiction, occult & supernatural, Fiction, fantasy, paranormal, nyt:combined-print-and-e-book-fiction=2019-10-27, New York Times bestseller, New York Times reviewed, Fiction, Women college students, Secret societies, Magic, Yale University"
45872054,The Kingdom of Back,Marie Lu,"Lu, Marie",,1524739014,9781524739010,0,3.71,G.P. Putnam's Sons Books for Young Readers,Hardcover,313.0,2020.0,2020.0,,2019/09/24,to-read,to-read (#76),to-read,,,,0,0,9781524739010,"Children's fiction, Mozart, wolfgang amadeus, 1756-1791, fiction, Fantasy fiction, Brothers and sisters, fiction, Musicians, fiction, nyt:young-adult-hardcover=2020-03-22, New York Times bestseller"
4865,How to Win Friends & Influence People,Dale Carnegie,"Carnegie, Dale",,,,3,4.22,Gallery Books,Paperback,288.0,1998.0,1936.0,2018/10/14,2019/05/14,,,read,,,,1,0,,No ISBN
81227,Infidel,Ayaan Hirsi Ali,"Ali, Ayaan Hirsi",,0743289684,9780743289689,5,4.2,Free Press,Hardcover,353.0,2007.0,2006.0,,2019/04/07,,,read,,,,2,0,9780743289689,"Politicians, Muslims, Refugees, Biography, Islam, Reading Level-Grade 7, Reading Level-Grade 9, Reading Level-Grade 8, Reading Level-Grade 11, Reading Level-Grade 10, Reading Level-Grade 12, 1000blackgirlbooks, New York Times reviewed, Politicians, europe, Muslims, europe, Netherlands, biography, Women politicians, Muslim women, Women refugees, Biographies &amp; autobiographies, General, Netherlands, politics and government"
20443235,"The Winner's Kiss (The Winner's Trilogy, #3)",Marie Rutkoski,"Rutkoski, Marie",,0374384738,9780374384739,5,4.2," Farrar, Straus and Giroux ",Hardcover,486.0,2016.0,2016.0,,2016/02/24,,,read,,,,2,0,9780374384739,"Fantasy, Love, War, Fiction, Children's fiction, Fantasy fiction, Love, fiction"
20443207,"The Winner's Crime (The Winner's Trilogy, #2)",Marie Rutkoski,"Rutkoski, Marie",,0374384711,9780374384715,4,4.08,Farrar Straus Giroux ,ebook,416.0,2015.0,2015.0,2019/04/03,2016/02/24,,,read,,,,1,0,9780374384715,"Secrets, Fantasy, Juvenile fiction, Love, Fiction, Children's fiction, Fantasy fiction, Love, fiction, JUVENILE FICTION / Fantasy & Magic, JUVENILE FICTION / Love & Romance, Royal weddings -- Fiction, Noces royales -- Romans, nouvelles, etc, Royal weddings"
16069030,"The Winner's Curse (The Winner's Trilogy, #1)",Marie Rutkoski,"Rutkoski, Marie",,0374384681,9780374384685,5,3.95,Farrar Straus Giroux ,ebook,355.0,2014.0,2014.0,2016/02/23,2016/02/09,,,read,"This book is supposed to be a romance story, and while that is true, there is so much more than just romance.  <br/><br/>I love the characters.  Especially the girl protagonist who isn't afraid to make the hard decisions because she can calmly weigh the pros and cons.  <br/><br/>The whole dynamic of the book is interesting and I can't wait to read the sequel.  Also, the romance really was one of the best non-contemporary romances I've ever read in a book.  <br/><br/>I highly recommend.",,,2,0,9780374384685,"Juvenile fiction, Man-woman relationships, Love, Slavery, Fiction, Children's fiction, Fantasy fiction, Love, fiction, Fantasy"
33876440,"This Mortal Coil (This Mortal Coil, #1)",Emily Suvada,"Suvada, Emily",,1481496336,9781481496339,4,4.12,Simon Pulse,Hardcover,425.0,2017.0,2017.0,2019/03/18,2019/03/18,,,read,I liked how the MC isn't afraid of doing gory stuff.,,,1,0,9781481496339,"Fathers and daughters, Science fiction, Plague, Hackers, Genetic engineering, Fiction, Children's fiction, Plague, fiction, Fathers and daughters, fiction"
34569846,As You Wish,Chelsea Sedoti,"Sedoti, Chelsea",,1492642312,9781492642312,3,3.56,Sourcebooks Fire,Hardcover,417.0,2018.0,2018.0,2019/02/17,2019/02/17,,,read,The concept is interesting and I really liked how realistic and complete the ending was but it just felt a bit lacking....,,,1,0,9781492642312,"Wishes, Magic, Juvenile fiction, Friendship, Family life, Fiction, Children's fiction, Magic, fiction, Friendship, fiction, Nevada, fiction, Family life, fiction"
32762917,"Nightfall (Keeper of the Lost Cities, #6)",Shannon Messenger,"Messenger, Shannon",,1481497421,9781481497428,5,4.53,Aladdin,ebook,576.0,2017.0,2017.0,2019/02/16,2016/10/29,,,read,,,,1,0,9781481497428,"Fiction, fantasy, middle grade, elves, psychic ability, identity, foster parents, magic, Ability, Memory, Children's fiction, Fairies, fiction, Friendship, fiction, Adventure and adventurers, fiction, Fantasy fiction, Moonlark, Black Swan, Neverseen"
32762937,"Flashback (Keeper of the Lost Cities, #7)",Shannon Messenger,"Messenger, Shannon",,1481497456,9781481497459,5,4.33,Aladdin,Kindle Edition,848.0,2018.0,2018.0,2019/02/16,2016/10/29,,,read,,,,1,0,9781481497459,"Fantasy, Psychic ability, Ability, Memory, Elves, Fiction, Children's fiction, young adult fiction, coming-of-age, friendship, family, love, loss, betrayal, redemption, elves, telepathy, superpowers, adventure, mystery, suspense"
31145133,I Believe in a Thing Called Love,Maurene Goo,"Goo, Maurene",,0374304041,9780374304041,5,3.57,"Farrar, Straus and Giroux (BYR)",Hardcover,336.0,2017.0,2017.0,2018/06/28,2017/05/22,,,read,,,,1,0,9780374304041,"Schools, Korean Americans, Love, Dating (Social customs), High schools, Children's fiction, Dating (social customs), fiction, Love, fiction, Schools, fiction, Korean americans, fiction, Young adult fiction, romance, contemporary"
31138556,Homo Deus: A History of Tomorrow,Yuval Noah Harari,"Harari, Yuval Noah",,,,0,4.2,Harper,ebook,450.0,2017.0,2015.0,,2018/08/04,to-read,to-read (#75),to-read,,,,0,0,,No ISBN
36127456,Listen to Your Heart,Kasie West,"West, Kasie",,133821005X,9781338210057,4,3.84,Point,Hardcover,336.0,2018.0,2018.0,2018/06/17,2018/06/17,,,read,,,,1,0,9781338210057,"Social media, Interpersonal relations, Infatuation, High schools, Best friends, Fiction, Podcasts, Children's fiction, Interpersonal relations, fiction, Friendship, fiction, Schools, fiction"
26194593,Nexus (Zeroes #3),Scott Westerfeld,"Westerfeld, Scott","Margo Lanagan, Deborah Biancotti",1925267253,9781925267259,5,4.0,Allen & Unwin,Paperback,432.0,2017.0,2017.0,2018/06/11,2016/10/18,,,read,"10/18/16:<br/><br/>Just like last year when I finished Zeroes, I NEED THIS THIRD BOOK HOLY WHY MUST I WAIT SO LONG<br/><img src=""https://66.media.tumblr.com/c923d4dd36165f98c0bb4a942871ca3e/tumblr_nue2jphRem1u2n8ijo1_250.gif""<br/><br/><br/>6/11/18 <br/>I JUST STARTED AND FINISHED THIS BOOK IN 3 HOURS.  I love this series so much.  holy crap. 10/10",,,1,0,9781925267259,Not Found
4671,The Great Gatsby,F. Scott Fitzgerald,"Fitzgerald, F. Scott",,0743273567,9780743273565,4,3.93,Scribner,Paperback,180.0,1925.0,1925.0,2018/04/25,2018/04/25,,,read,,,,2,0,9780743273565,"Modern fiction, Traffic accidents, First loves, Classics, Literature, Fiction, Manuscripts, Facsimiles, Rich people, Mistresses, Open library staff picks, Revenge, Man-woman relationships, Wealth, Readers, Economic conditions, American fiction, Upper class, Social life and customs, American manuscripts, Married women, Long now manual for civilization, Fictional works publication type, Man-woman relationship, Rich people -- fiction, Romance fiction, Long island (n.y.) -- fiction, Psychological fiction, Love stories, Novela, Relaciones hombre-mujer, Spanish language materials, Literary, Nouveau riche, Reading level-grade 11, Reading level-grade 12, Fiction / general, Moral conditions, Manners and customs, American fiction (fictional works by one author), New york (n.y.), fiction, Long island (n.y.), fiction, Married people, fiction, Fiction, psychological, Fiction, general, Fitzgerald, f. scott (francis scott), 1896-1940, Man-woman relationships, fiction, Large type books, Nineteen twenties, English fiction, Rich"
35068742,"Love, Life, and the List (Love, Life, and the List, #1)",Kasie West,"West, Kasie",,0062675788,9780062675781,5,3.8,HarperTeen,ebook,400.0,2017.0,2017.0,,2018/04/25,,,read,,,,2,0,9780062675781,"Children's fiction, Artists, fiction, Interpersonal relations, fiction, Youth, fiction"
5246,Ethan Frome,Edith Wharton,"Wharton, Edith","Anita Shreve, Elizabeth Ammons",,,3,3.45,Penguin Classics,Paperback,99.0,2005.0,1911.0,2018/01/15,2018/01/15,,,read,,,,2,0,,No ISBN
36344130,Kissing Games,Tara Eglington,"Eglington, Tara",,1250075262,9781250075260,0,3.91,Wednesday Books St Martins,Hardcover,352.0,2018.0,2013.0,,2018/01/13,to-read,to-read (#74),to-read,,,,0,0,9781250075260,"Children's fiction, Dating (social customs), fiction, Friendship, fiction, Schools, fiction, Humorous stories"
28006120,"The Ship of the Dead (Magnus Chase and the Gods of Asgard, #3)",Rick Riordan,"Riordan, Rick",,1423160932,9781423160939,3,4.37,Disney-Hyperion Books,Hardcover,410.0,2017.0,2017.0,2017/12/31,2016/01/18,,,read,,,,1,0,9781423160939,"Norse gods. Saving the worlds. Try to not die., Norse Mythology, Adventure and adventurers, Fantasy fiction, Juvenile fiction, Ships, Fiction, JUVENILE FICTION / Action & Adventure, Adventure stories, JUVENILE FICTION / Fantasy & Magic, JUVENILE FICTION / Legends, Myths, Fables / Norse, JUVENILE FICTION / Action & Adventure / General, Children's fiction, Adventure and adventurers, fiction, Gods, fiction, nyt:series-books=2017-10-22, New York Times bestseller, Magic, Mythologie nordique, Romans, nouvelles, etc. pour la jeunesse"
12296,The Scarlet Letter,Nathaniel Hawthorne,"Hawthorne, Nathaniel","Nina Baym, Thomas E. Connolly",0142437263,9780142437261,2,3.44,Penguin Books,Paperback,279.0,2002.0,1850.0,2017/12/14,2017/12/14,,,read,,,,1,0,9780142437261,"Fiction, Puritans, Puritans in fiction, History, Adultery in fiction, Adultery, Illegitimate children, Illegitimate children in fiction, Triangles (Interpersonal relations), Clergy, Married women in fiction, Married women, Clergy in fiction, Revenge, Revenge in fiction, Women immigrants, Women immigrants in fiction, Massachusetts in fiction, American fiction, Women, Women in fiction, Study guides, New England in fiction, Social life and customs, Examinations, Juvenile fiction, Young adult fiction, England in fiction, Vocabulary, Historical fiction, SAT (Educational test), English language, Nathaniel Hawthorne, Littérature, Adultère, Femmes, The scarlet letter (Hawthorne), Puritains, Romans, nouvelles, Romance Norte Americano, Manners and customs in fiction, Religeous Extremism in fiction, Interpersonal relations, Human relations, Mortal Sin, Hester Prynne (Fictitious character), Illegitimacy, Women tailors, Readers for new literates, High interest-low vocabulary books, Sound recordings for foreign speakers, Study and teaching as a second language, French, Psychological fiction, Manners and customs, Scarlet letter (Hawthorne, Nathaniel), Hawthorne, Nathaniel, 1804-1864, German, Spanish, American literature, Non-Classifiable, Children's fiction, Boston (mass.), fiction, Massachusetts, fiction, American fiction (fictional works by one author), Prynne, hester (fictitious character), fiction, Fiction, historical, New england, fiction, Clergy, fiction, Man-woman relationships, fiction, Married people, fiction, Fiction, psychological, Drama (dramatic works by one author), Fiction, romance, general, American literature, history and criticism, Large type books, FICTION / Classics, FICTION / Literary, Fiction, general, Reading comprehension, Problems, exercises, Readers (Adult), Foreign speakers, Study and teaching, Readers, English language, textbooks for foreign speakers, Fiction, war & military, Puritanos, Novela, Mujeres, Adulterio, Frau, Ehebruch, Interpersonal relations, fiction, Puritans, fiction, Fiction, historical, general, Young women, fiction, Adulteresses, Histoire, Triangle (Relations humaines), Enfants naturels, Immigrantes, Femmes mariées, Vengeance, Clergé, Classics, Literary, American literature (collections), Economic policy, World War, 1939-1945, Economic aspects, General, Dictionaries"
34076952,"The Language of Thorns: Midnight Tales and Dangerous Magic (Grishaverse, #0.5, 2.5, 2.6)",Leigh Bardugo,"Bardugo, Leigh",Sara Kipin,125012252X,9781250122520,4,4.28,Imprint,Hardcover,281.0,2017.0,2017.0,2017/11/26,2017/11/26,,,read,,,,1,0,9781250122520,"Young adult fiction, Love, Fantasy fiction, Sacrifice, Betrayal, Revenge, Fiction, Magic, Short stories, Juvenile fiction, Fantasy, Children's fiction, Magic, fiction, nyt:young-adult-hardcover=2017-10-15, New York Times bestseller"
29283087,Braced,Alyson Gerber,"Gerber, Alyson",,0545902142,9780545902144,0,4.2,Scholastic Press,Hardcover,304.0,2017.0,2017.0,,2017/11/15,to-read,to-read (#73),to-read,,,,0,0,9780545902144,"Genetic disorders, Families, Orthopedic braces, Mothers and daughters, Scoliosis in children, Self-consciousness (Sensitivity), Fiction, Children's fiction, Mothers and daughters, fiction, Family life, fiction, Massachusetts, fiction, Family, fiction, Families -- Massachusetts -- Fiction, Genetic disorders -- Fiction, Mothers and daughters -- Fiction, Orthopedic braces -- Fiction, Scoliosis in children -- Fiction, Self-consciousness (Sensitivity) -- Fiction, Massachusetts -- Andover -- Fiction"
31293988,"Kiss Him, Not Me!, Vol. 11",Junko,"Junko, Junko",,1632364379,9781632364371,5,4.0,Kodansha Comics,Paperback,160.0,2017.0,2017.0,,2017/11/05,,,read,,,,1,0,9781632364371,"Graphic novels, High school students, Dating (Social customs), Comic books, strips, Comics & graphic novels, gay & lesbian"
31749737,"Kiss Him, Not Me #10",Junko,"Junko, Junko",,,,4,4.17,Kodansha Comics,Kindle Edition,40.0,2016.0,,,2017/11/05,,,read,,,,1,0,,No ISBN
30419645,"Kiss Him, Not Me!, Vol. 9",Junko,"Junko, Junko",,1632363437,9781632363435,4,4.05,Kodansha Comics,Paperback,160.0,2017.0,2016.0,2017/11/05,2017/11/05,,,read,,,,1,0,9781632363435,"High school students, Dating (Social customs), Comic books, strips, Comics & graphic novels, manga, gay & lesbian"
2956,The Adventures of Huckleberry Finn,Mark Twain,"Twain, Mark","Guy Cardwell, E.W. Kemble, John Seelye, Walter Trier, Tom Wilson, William Little Hughes",0142437174,9780142437179,3,3.83,Penguin Classics,Paperback,327.0,2002.0,1884.0,2017/11/02,2017/10/16,,,read,,,,1,0,9780142437179,"adventure and adventurers, Adventure stories, American fiction (fictional works by one author), American literature, Boys, Child and youth fiction, Children's fiction, child witnesses, Courtship, English language, friendship, Fugitive slaves, history, humor, Humorous stories, Juvenile fiction, juvenile literature, literature, Loyalty, Male friendship, Manners and customs, orphans, Personnages, Race relations, rafting, Rafting (Sports), Revenge, Runaway children, Runaways, runaway teenagers, satire, Sisters, slavery, Slaves, Social classes, social history-United States-1800s, Social life and customs, Travel, Voyage, voyages and travels, young men, Young women, American literature, history and criticism, 19th century, American literature, outlines, syllabi, etc., American manuscripts, amitie masculine, Anglais (langue), boys in literature, Dictionaries, Dummies (Bookselling), enfants fugueurs, English as a second language, esclaves fugitifs, Examinations, Facsimiles, Foreign speakers, garcons, Garçons, Literary Criticism, Long Now Manual for Civilization, Manuscripts, open_syllabus_project, Readers, Readers for new literates, relations raciales, Romans, Rôle selon le sexe dans la littérature, Specimens, Study and teaching, Study guides, Fiction, Huckleberry Finn (Fictitious character), Romans, nouvelles, etc. pour la jeunesse, Voyages, Amitié, Histoire, Fiction, general, Mississippi river, fiction, Missouri, fiction, Adventure and adventurers, fiction, Slavery, fiction, Finn, huckleberry (fictitious character), fiction, Runaways (Fictitious characters), Romans, nouvelles, Friendship, fiction, Boys, fiction, Voyages and travels -- Fiction, Friendship -- Fiction, Slavery -- Fiction, Mississippi River -- Fiction, Missouri -- History -- 19th century -- Fiction, Children's literature, American fiction, Roman américain, Amitié masculine, Livres en gros caractères, Classes sociales, Jeunes femmes, Amours, Sœurs, Large print books, Fictional Works Publication Type, Adventures of Huckleberry Finn (Twain, Mark), Criticism and interpretation, Race relations in literature, Coming of age, Huckleberry Finn (Fictional character), Humorous, Action & Adventure, Mississippi, fiction, Enslaved persons, fiction, Fiction, coming of age, Fiction, humorous, general, Southern states, fiction, Finn, huckleberry, Finn, huckleberry (fictitious character), Finn, huckleberry (fictitious character)--fiction, Runaway children--fiction, Male friendship--fiction, Fugitive slaves--fiction, Race relations--fiction, Boys--fiction, Ps1305 .a1 2003, 813/.4, Twain, mark , 1835-1910, Boys--travel, Boys--travel--mississippi river--fiction, Sex role in literature, Boys--missouri--fiction, Ps1305.a2 g73 1995, Ps1305 .t93 1999, Boys & men, In literature, Spanish, French, The adventures of huckleberry finn (twain), Relations raciales dans la littérature, Huckleberry finn, Finn, huckleberry (personnage fictif), Fiction, action & adventure, Slaves, fiction, Fiction, humorous, United states, history, Twain, mark, 1835-1910, Sawyer, tom (fictitious character), fiction, Literature and fiction, juvenile, Fiction, historical, Tom sawyer (fictitious character), Aventuras-, Novelas-, Libros infantiles, Abenturak-, Eleberriak-, Haur eta gazteentzako liburuak, Wit and humor, History and criticism, Library, Personal copy"
34927042,"Alex, Approximately",Jenn Bennett,"Bennett, Jenn",,1534404945,9781534404946,0,3.94,Simon Pulse,Paperback,388.0,2017.0,2017.0,,2017/10/21,to-read,to-read (#72),to-read,,,,0,0,9781534404946,"Fathers and daughters, Identity (Philosophical concept), Dating (Social customs), Household Moving, Juvenile fiction, Identity, Fiction, Children's fiction, Love, fiction, Identity, fiction, Dating (social customs), fiction, Fathers and daughters, fiction, Moving, household, fiction, California, fiction, Identity -- Fiction, Dating (Social customs) -- Fiction, Fathers and daughters -- Fiction, Moving, Household -- Fiction, Identity (Philosophical concept) -- Juvenile fiction, Dating (Social customs) -- Juvenile fiction, Fathers and daughters -- Juvenile fiction, Moving, Household -- Juvenile fiction, California -- Fiction, California -- Juvenile fiction"
28919058,Autoboyography,Christina Lauren,"Lauren, Christina",,1481481681,9781481481687,0,4.12,Simon & Schuster Books for Young Readers,Hardcover,407.0,2017.0,2017.0,,2017/10/18,to-read,to-read (#71),to-read,,,,0,0,9781481481687,"Families, Juvenile fiction, Bisexuality, Family life, Fiction, Mormons, Dating (Social customs), High schools, Schools, Authorship, Children's fiction, Authorship, fiction, Schools, fiction, Dating (social customs), fiction, Family life, fiction, Utah, fiction, LGBTQ young adult, collectionID:EanesChallenge, collectionID:bannedbooks"
31931941,Eliza and Her Monsters,Francesca Zappia,"Zappia, Francesca",,0062290134,9780062290137,0,4.14,Greenwillow Books,Hardcover,385.0,2017.0,2017.0,,2017/09/28,to-read,to-read (#70),to-read,,,,0,0,9780062290137,"Webcomics, Depressions, Mental Depression, Juvenile fiction, Fiction, Schools, Dating (Social customs), Anonymous persons, Self-reliance, Children's fiction, Schools, fiction, Friendship, fiction"
15839984,Cruel Beauty,Rosamund Hodge,"Hodge, Rosamund",,0062224735,9780062224736,0,3.64,Balzer + Bray,Hardcover,346.0,2014.0,2014.0,,2017/09/26,to-read,to-read (#69),to-read,,,,0,0,9780062224736,"Children's fiction, Fantasy fiction, Marriage, fiction, Fantasy, Beauty and the beast (Tale), Juvenile fiction, Assassins, Forced marriage, Demonology, Blessing and cursing, Arranged marriage, Fiction"
