Book Id,Title,Author,Author l-f,Additional Authors,ISBN,ISBN13,My Rating,Average Rating,Publisher,Binding,Number of Pages,Year Published,Original Publication Year,Date Read,Date Added,Bookshelves,Bookshelves with positions,Exclusive Shelf,My Review,Spoiler,Private Notes,Read Count,Owned Copies,Used ISBN,Genre
29939230,"A Conjuring of Light (Shades of Magic, #3)",Victoria E. Schwab,"Schwab, Victoria E.",,0765387468,9780765387462,0,4.3,Tor,Hardcover,624.0,2017.0,2017.0,,2021/07/12,to-read,to-read (#162),to-read,,,,0,0,9780765387462,"FANTASY, Magicians, Magic, Quantum theory, Space and time, Fiction, London (england), fiction, Fiction, fantasy, historical, nyt:hardcover-fiction=2017-03-12, New York Times bestseller, American literature"
18248613,"Warm Up  (Villains, #0.5)",Victoria E. Schwab,"Schwab, Victoria E.",,,,0,3.76,Tor Books,Kindle Edition,15.0,2013.0,2013.0,,2021/07/12,to-read,to-read (#161),to-read,,,,0,0,,No ISBN
530848,"Eighth Grade Bites (The Chronicles of Vladimir Tod, #1)",Heather Brewer,"Brewer, Heather",Z Brewer,0525478116,9780525478119,4,3.93,Dutton Children's Books,Hardcover,182.0,2007.0,2007.0,,2021/07/11,,,read,,,,1,0,9780525478119,"Fiction, Juvenile fiction, Vampires, Junior high schools, Orphans, Horror stories, Schools"
36307634,"King of Scars (King of Scars, #1)",Leigh Bardugo,"Bardugo, Leigh",,125014227X,9781250142276,0,4.16,Imprint,Kindle Edition,511.0,2019.0,2019.0,,2021/04/22,currently-reading,currently-reading (#1),currently-reading,,,,1,0,9781250142276,"Children's fiction, Magic, fiction, Kings, queens, rulers, etc., fiction, Adventure and adventurers, fiction, nyt:young-adult-hardcover=2019-02-17, New York Times bestseller, nyt:young-adult-paperback-monthly=2021-02-07, Kings and rulers, Juvenile fiction, Imaginary wars and battles, Generals, Demonology, Magic, Fiction, Adventure stories, Fantasy, Adventure and adventurers, YOUNG ADULT FICTION, Action & Adventure, Fantasy fiction"
39863498,"The Gilded Wolves (The Gilded Wolves, #1)",Roshani Chokshi,"Chokshi, Roshani",,125014454X,9781250144546,0,3.71,Wednesday Books,Hardcover,388.0,2019.0,2019.0,,2021/07/07,to-read,to-read (#160),to-read,,,,0,0,9781250144546,"Children's fiction, Fantasy fiction, Buried treasure, fiction, Magic, fiction, Paris (france), history, fiction, nyt:young-adult-hardcover=2019-02-03, New York Times bestseller"
52867387,Beach Read,Emily Henry,"Henry, Emily",,1984806734,9781984806734,4,3.99,Berkley,Paperback,400.0,2020.0,2020.0,2021/07/07,2021/06/18,,,read,"This book was exactly what I needed. Something light, fluffy, cute. The romance was cute and had me squealing, though some parts of the book were a little slow, so that's why it's 4 stars. ",,,1,0,9781984806734,"American literature, Fiction, romance, contemporary, nyt:combined-print-and-e-book-fiction=2020-06-07, New York Times bestseller"
52696571,Parachutes,Kelly Yang,"Yang, Kelly",,0062941089,9780062941084,4,4.19,Katherine Tegen Books,Hardcover,496.0,2020.0,2020.0,2021/03/09,2020/11/30,,,read,"So this book was interesting. The beginning had me a little bit irked. I felt as if the dynamics and writing of the characters of parachutes and ABC's and white students in LA high school didn't feel natural or realistic. I attributed this to the author's lack of going to a high school at high school age since she went to college at the age of 13. <br/><br/>However, as the book changed course into more serious topics of  predatory sexual assault and rape, the story got more engaging and horrifying. I felt as if the writing improved and felt more real. Sadly. (Because obviously rape and sexual assault is bad but the writing was so much better.) <br/><br/>I read the author's note at the end and can understand why her writing felt more realistic. I really hope that in the alternate universe of this book that Clair and Dani really do get justice for what happened. <br/><br/>I also hope that to the girls that this actually happens to in real life that eventually in society girls who get assaulted and raped can seek help instead of feeling shame for something that was not their fault. <br/><br/>This book overall had a good message and went in a direction that I did not expect, but was glad that it did.",,,1,0,9780062941084,"Young adult fiction, social themes, sexual abuse, Young adult fiction, social themes, emotions & feelings, Young adult fiction, social themes, emigration & immigration, New York Times reviewed"
38596562,Sex Ed,MrBenzedrine89,"MrBenzedrine89, MrBenzedrine89",,,,3,3.87,Archive of Our Own,ebook,469.0,2016.0,,2021/07/04,2021/07/03,,,read,Ugh. I mean it was cute and nice and all I just want something like manacled :(,,,1,0,,No ISBN
55338924,Impostor Syndrome,Kathy Wang,"Wang, Kathy",,006285528X,9780062855282,0,3.27,Mariner Books,Hardcover,368.0,2021.0,2021.0,,2021/07/01,to-read,to-read (#159),to-read,,,,0,0,9780062855282,"espionage, high-tech firms, social satire, coporate responsibility, American literature, Businesswomen, Fiction, Competition (Psychology), Moles (Spies), Business intelligence, Loyalty, Secrecy"
2247142,"The Talented Mr. Ripley (Ripley, #1)",Patricia Highsmith,"Highsmith, Patricia",,,,0,3.95,W. W. Norton  Company,Paperback,271.0,2008.0,1955.0,,2021/06/29,to-read,to-read (#157),to-read,,,,0,0,,No ISBN
36140968,Black Tabs,Victoria E. Schwab,"Schwab, Victoria E.",,,,0,4.62,Tor,Unknown Binding,,,,,2021/06/27,to-read,to-read (#156),to-read,,,,0,0,,No ISBN
44232064,"Victorious (Villains, #3)",Victoria E. Schwab,"Schwab, Victoria E.",,,,0,4.36,Tor Books,Unknown Binding,,,,,2021/06/27,to-read,to-read (#155),to-read,,,,0,0,,No ISBN
34323570,"Furyborn (Empirium, #1)",Claire Legrand,"Legrand, Claire",,1492656623,9781492656623,0,3.79,Sourcebooks Fire,Hardcover,501.0,2018.0,2018.0,,2021/06/27,to-read,to-read (#154),to-read,,,,0,0,9781492656623,"Prophecies, Fate and fatalism, Magic, Imaginary wars and battles, Quests (Expeditions), Fiction, Children's fiction, Fantasy fiction, Magic, fiction, nyt:young-adult-hardcover=2018-06-10, New York Times bestseller"
41150487,"Red, White & Royal Blue",Casey McQuiston,"McQuiston, Casey",,1250316774,9781250316776,1,4.07,St. Martin's Griffin,Paperback,448.0,2019.0,2019.0,2021/06/26,2021/06/22,,,read,"God this book was so fucking annoying. I really went into it with high hopes and wanting to love it so bad because it was supposed to be adorable and cute. <br/><br/>Instead what I got was the most annoying, selfish, arrogant, rude, privileged  main character, Alex who could not shut up about how his life sucked so bad. Honestly, the amount of times he complained that being half mexican made him less privileged than the millions of white people despite being the FSOTUS was cringy af. <br/><br/>I would not want Alex to be a politician. Frankly, he gets drunk wasted every other night and is totally an alcoholic yet that's never mentioned. <br/><br/>Harry was alright, I actually kinda liked his character. But, since the story was told from Alex's point of view it was annoying af. Also, the amount of white savior democrats will save all the minorities was a little too fucking prevalent for this book to be enjoyable. <br/><br/>Quite frankly, McQuiston's writing was just low level and this read like a wattpad fanfic from middle school. I don't think I'll read another book by her again. ",,,1,0,9781250316776,No categories available
58383086,Various Storms and Saints,viridianatnight,"viridianatnight, viridianatnight",,,,4,4.2,Archive of Our Own,ebook,450.0,,,2021/06/21,2021/06/21,,,read,"This was a refreshingly unique fic. It was really sweet I love a good ronBashing and this really satisfied that. <br/>Though, based on everything I feel as if Hermione really should've died... ",,,1,0,,No ISBN
55725741,"Six Crimson Cranes (Six Crimson Cranes, #1)",Elizabeth Lim,"Lim, Elizabeth",,0593300912,9780593300916,0,4.19,Knopf Books for Young Readers,Hardcover,456.0,2021.0,2021.0,,2021/06/21,to-read,to-read (#153),to-read,,,,0,0,9780593300916,"nyt:young-adult-hardcover=2021-07-25, New York Times bestseller, Children's fiction"
50623864,The Invisible Life of Addie LaRue,Victoria E. Schwab,"Schwab, Victoria E.",,0765387565,9780765387561,5,4.18,Tor Books,Hardcover,448.0,2020.0,2020.0,2021/06/19,2020/11/16,,,read,"I am broken. <br/><br/>Sometimes I regret giving 5 stars to all these other books I've read recently and in the past because when I give this book 5 stars it means something entirely different. How this book destroyed me is entirely different. How this book exists is in a different space as all those other books. <br/><br/>The Invisible Life of Addie LaRue may be one of the best books I've read this year so far, if not one of the best books I've read ever. <br/><br/>This is the first V.E. Schwab book I've read and is definitely not the last. The writing was beautiful, the way that Schwab interlaced the past and the present was perfection. The way I got to understand the characters together was insanity. And the ending. (not a spoiler) but the ending. I thought of how the book could end as I was reading. Thought of so many different scenarios and endings... What I wanted to happen, how I thought it would end because there was no way Schwab could be so nice... it had to be cruel... Instead the ending was both everything I wanted and nothing I wanted. What I didn't expect until I did. <br/><br/>This book was beautiful throughout. I'm glad that I bought it in the spur of the moment and read it because I wasn't intending to read it, but I did. <br/><br/>Wow. Fantastic amazing novel. I need to wipe my tears now. Wow",,,1,0,9780765387561,"nyt:combined-print-and-e-book-fiction=2020-10-25, New York Times bestseller, Fiction, fantasy, historical, LGBTQ fantasy & science fiction"
32333338,Save the Date,Morgan Matson,"Matson, Morgan",,1481404571,9781481404570,3,3.75,Simon & Schuster Books for Young Readers,Hardcover,417.0,2018.0,2018.0,2021/06/18,2019/04/07,,,read,"Honestly not the best Morgan Matson book out there but it was still enjoyable. I feel like some parts were drawn out a little too long and the book could have benefitted from being a hundred pages shorter. Overall, I still enjoyed it for what it was. <br/><br/><spoiler> also like idk if this is weird asf but like what happened to Brooke literally happened to me like a month and a half ago. I was dating a dude for a few months and I travelled 6 hours to his house for his brother's wedding. And then didn't pay attention to me at all.... and then broke up with me right after the wedding. AHAHHA I thought my life experiences were unique but apparently nothing more than a super small subplot in a contemporary novel. LOL. </spoiler> ",,,1,0,9781481404570,"Fiction, Weddings, Families, Brothers and sisters, Family life, nyt:young-adult-hardcover=2018-06-24, New York Times bestseller, Children's fiction, Marriage, fiction, Brothers and sisters, fiction, Family life, fiction"
42201431,"The Unhoneymooners (Unhoneymooners, #1)",Christina Lauren,"Lauren, Christina",,1501128035,9781501128035,5,3.9,Gallery Books,Paperback,432.0,2019.0,2019.0,2021/06/18,2021/05/06,,,read,Ahhh this was the perfect enemies to lovers. So cute! It's rated pg-13 which I was surprised but happy about.  <br/><br/>Ethan and Olive are just perfection!,,,1,0,9781501128035,"Fiction, romance, contemporary, Fiction, humorous, nyt:trade-fiction-paperback=2021-06-06, New York Times bestseller"
48896122,The Ivies,Alexa Donne,"Donne, Alexa",,0593303709,9780593303702,5,3.68,Crown,Hardcover,312.0,2021.0,2021.0,2021/06/17,2021/04/29,,,read,"Now, I did go to a public school in California, not a boarding school in the north east, but my high school was really competitive for colleges so that is why I was originally interested in this book. <br/><br/>I never had aspirations for an Ivy league because I was never gonna be good enough, but I still had pressures to Early Decision to a private school. So, I did understand a lot of the feelings of all the kids on ED day in the first part of the book. I particularly loved the shout out to r/applyingtocollege because I would check that subreddit religiously throughout junior and senior year, even making a couple posts. (I'm currently a rising Junior in college c/o 2023). I'm so glad that college applications are in the past for me. <br/><br/>I loved the premise of the book and the way it was told. I did not predict the end at all. (I didn't even really realize it was technically a mystery when I first started reading the book.) <br/><br/><spoiler> When the reason on why Tyler killed Emma comes to light in the end. (Literally so he has a good college essay) I was shocked but honestly it's not even as weirder than thinking Avery killed her for taking her spot at Harvard. I feel bad that Olivia got rescinded from Harvard while Ethan got to go. (Honestly fuck Ethan I really wanted him to be a nice sweet boy that Olivia was going to fall in love with but he is a major dick head) I'm glad Olivia got into Smith later after her forced gap year, but it's no Harvard. The ending is very bitter sweet. It isn't fair that the rest of the Ivies still got to go to good schools. </spoiler><br/><br/><br/><br/>But, I was hooked and polished the book off in one sitting in a couple hours.  ",,,1,0,9780593303702,"Thriller, young adult"
49097862,The Gloriana Set,unknown author,"author, unknown",,,,3,3.88,Archive of Our Own,ebook,81.0,2018.0,2018.0,2021/06/17,2021/06/15,,,read,"Honestly the first half was fire good. I stayed up late devouring it and giggling like a mad person but it kinda stalled in the last half and the ending, while not bad, wasn't very stand out. 3.5 stars.",,,1,0,,No ISBN
26823946,Nightmare,Provocative Envy,"Envy, Provocative",,,,3,3.85,Fanfiction.net,Unknown Binding,550.0,2014.0,2013.0,2021/06/12,2021/06/12,,,read,ahhhh it had so much potential i was so intrigued in the first half but the ending was not what i wanted or expected at all. The ending really ruined it for me :(,,,1,0,,No ISBN
58198933,On the Nature of Daylight,ikorous,"ikorous, ikorous",,,,4,3.7,archiveofourown,ebook,1388.0,2021.0,2021.0,2021/06/11,2021/06/11,,,read,I thought since it said it was completed that I would be satisfied with the end. But it's a freaking first book and the author is only 2 chapters into the sequel. <br/><br/>;-;-;-; <br/><br/>I hope Draco and Hermione get together </3 <br/><br/>It was so cute and ajsdlfjaslkd i need to know what happens. ,,,1,0,,No ISBN
57101555,Mudblood,ComfortableSilences,"ComfortableSilences, ComfortableSilences",,,,2,3.61,ao3,ebook,243.0,2008.0,,2021/06/11,2021/06/11,,,read,Honestly one of the worst dramione fanfics I've read. The development was terrible and the characters were terribly ooc,,,1,0,,No ISBN
23367265,"Immortal Reign (Falling Kingdoms, #6)",Morgan Rhodes,"Rhodes, Morgan",,1595148248,9781595148247,5,4.16,Razorbill ,Hardcover,391.0,2018.0,2018.0,2021/06/09,2016/03/05,,,read,Wow! What an amazing finale to an amazing series. <br/><br/>I was a big scared because I had heard that the ending was not good but I really loved this book! <br/><br/>Magnus and Cleo forever <3!  I like that it wrapped most things up nicely but there was still so much left to the imagination. <br/><br/>There was enough happy stuff but there was also such sacrifice and bad stuff that happened too in the end. <br/><br/>I really loved this series and I'm so glad that I took the time to reread the first 4 book and finally finish by reading the 5th and 6th book. <br/><br/>Wonderful! I have really no complaints at all. Nothing to nitpick over either.,,,1,0,9781595148247,"Gods, Fiction, Magic, Princes, Princesses, Children's fiction, Princes, fiction, Princesses, fiction, Gods, fiction, Magic, fiction, Fantasy fiction, nyt:series-books=2018-02-25, New York Times bestseller"
23367261,"Crystal Storm (Falling Kingdoms, #5)",Morgan Rhodes,"Rhodes, Morgan",,1595148221,9781595148223,5,4.2,Razorbill ,Hardcover,379.0,2016.0,2016.0,2021/06/09,2016/03/05,,,read,What the actual fuck holy shit this book was amazing. I'm actually dead the cliffhanger. Thank god I have the 6th book in front of me or I would've died. I can't believe people had to wait an entire year on this cliffhanger. <br/><br/>Magnus and Cleo <3 <3 <3. I swear to god if they don't end up happy together I'm going to be so upset.<br/><br/>Everything is happening so quickly and I'm leaving this barely even shit review because I just want to read the 6th book immediately.,,,1,0,9781595148223,"Families, Magic, Princes, Fiction, Children's fiction, Princes, fiction, Family, fiction, Magic, fiction, Fantasy fiction"
17342701,"Frozen Tides (Falling Kingdoms, #4)",Morgan Rhodes,"Rhodes, Morgan",Michelle Rowen,1595147071,9781595147073,5,4.3,Razorbill,Hardcover,413.0,2015.0,2015.0,2016/06/28,2016/03/05,,,read,"Once again I was absolutely  blown away!  This series keeps getting better and better.  AND THE SHIP!! IDK WHAT PEOPLE ARE CALLING IT BUT MAGLEO?? OMG I LOVE LOVE LOVE EVERYTHING<br/><br/><br/>Edit June 8, 2021: <br/><br/>Wow, okay this book is by far the best book in the series so far. I'm so glad that Magnus and Cleo are taking steps forward with their relationship its soooo cute I stan. Everything is getting so wild and I can't wait to see how this series ends. Also the cliffhanger was insane I can't believe that when I read this book 5 years ago I had to wait an entire year for the 5th book and then ended up never continuing it because I had forgotten everything.<br/><br/>Now, all the books are out, and have been for some time so I can swiftly start reading the 5th book in a few moments, thank god. <br/><br/><spoiler> I can't believe that Lysandra just died like that! I thought she had become too important to die and yet she's dead and it makes me so sad. I really liked her character as she was a girl who came from nothing and was super strong and a great fighter. Now all the female characters left are royalty. Although I love Cleo and she's amazing, Lys was just something else and I'm really sad that she had to die. </spoiler> <br/><br/>I'm really interested on how Lucia's character arc will play out and what's happening to her and what her true goals are. <spoiler> the pregnancy troupe is a big ooop. Might be the one thing I'm not a fan about in this book. </spoiler> ",,,2,0,9781595147073,"Fantasy, Families, Magic, Princes, Fiction, Children's fiction, Fantasy fiction, JUVENILE FICTION / Fantasy & Magic, JUVENILE FICTION / Family / Multigenerational, JUVENILE FICTION / Love & Romance"
17342700,"Gathering Darkness (Falling Kingdoms, #3)",Morgan Rhodes,"Rhodes, Morgan",Michelle Rowen,1101623209,9781101623206,5,4.22,Razorbill,Paperback,416.0,2014.0,2014.0,2016/06/16,2016/03/05,,,read,"Once again, nothing but perfection.<br/><br/>Edit June 8, 2021: <br/><br/>This book was really good, we learned so much more about the magic and the Kindred and the Watchers but there's still much more that we're needed to learn. <br/><br/>I love everyone's character development and... well... I'm liking Magnus again. Definitely not the the point I was obsessing over him 5 years ago but he is totally getting better in my opinion. <br/><br/>Also, ngl, I was shipping Cleo and Jonas for a while... but Cleo and Magnus are also cute the tension in that one scene was really good. Perfection. ",,,2,0,9781101623206,Not Found
54456742,"Echoes and Empires (Echoes and Empires, #1)",Morgan Rhodes,"Rhodes, Morgan",,0593351657,9780593351659,0,3.72,Razorbill,Hardcover,400.0,2022.0,2022.0,,2021/06/07,to-read,to-read (#152),to-read,,,,0,0,9780593351659,Children's fiction
16000044,"Rebel Spring (Falling Kingdoms, #2)",Morgan Rhodes,"Rhodes, Morgan",Michelle Rowen,1595145931,9781595145932,5,4.07,Razorbill,Hardcover,401.0,2013.0,2013.0,2016/06/02,2016/03/05,,,read,"I loved this book, a lot.  Not as much as the first one, though.  <br/><br/>MAGNUS IS MY BABY AND IF ANYTHING HAPPENS TO HIM, ILL CRY AND CRY AND CRY AND CRY.   <br/><br/>ALSO, IT'S SO REFRESHING THAT SO MANY PEOPLE DIED.  The author just kind of killed one side character after another and I was like, stop, no, what are you doing?  But, I just I just don't know anymore.<br/><br/>Edit June 7, 2021: <br/><br/>I try to write my reviews for reread books without reading my previous ones so I can compare my thoughts from 5 years ago to todays thoughts. <br/><br/>However, I did glimpse the first line and I do agree that this book was not as good as the first book. However, there was so much more development in the world and premise of the story that I am excited to see play out in the rest of the series. <br/><br/>Ngl, Magnus really do be falling for Cleo but then is like ""ew gross the only woman I love is my sister."" Like chill dude, I know that y'all ain't related by blood but you grew up thinking you were and like you should be happy that you're falling for someone who isn't your sister. <br/><br/>I like Jonas' character a lot and lowkey ship him with Cleo more than I do Magnus. I feel as this is different from my thoughts before because I knew I used to like Magnus a lot more 5 years ago than I am on this reread. <br/><br/>Also why is this book so much more violent than I remember like so many people are getting murdered and killed it's so crazy. Like I like these characters and then bamidy wam bam they're dead and I'm like wtf. <br/><br/>Not really a 5/5 star read but close enough so I won't change my rating.  ",,,2,0,9781595145932,"Fantasy, Princesses, Fiction, Juvenile fiction, Fantasy fiction, Children's fiction, Princesses, fiction"
7896527,"Throne of Glass (Throne of Glass, #1)",Sarah J. Maas,"Maas, Sarah J.",,,,2,4.18,Bloomsbury USA Children's,Hardcover,406.0,2012.0,2012.0,2020/08/01,2020/08/01,,,read,"I finally bit the bullet to read this book after countless recommendations and owning the book for 5 years. And it was pretty enjoyable to read. <br/><br/>My youngerself would've enjoyed this book far more than I did but there were a bunch of little things that threw me off. <br/><br/>For one, the very beginning with descriptions of the characters. It was so laughable of how gorgeous she used to be. And ofc Dorian has those startling blue eyes and the ""raven-black hair"" like every other male lead in a YA romance. <br/><br/>There were some things that irked one; one being they always talk about how she is so terrifying, and murderous. How she did all these things in her past that proved her to be the BEST assassin, to have no heart. But, there is 0 proof in this entire novel. She doesn't do anything. Action speaks louder than words. Don't tell us that she is such a badass and give us no proof that she is. Also, I don't care if she was trained in extreme and horrible conditions from ages 8-14. She is an underweight skinny average height female who is 18. It would not be easy for her to beat a 250 pound 6ft+ super trained male solider. <br/><br/>In fact the one time she was shown to struggle, in the first test <spoiler> she can barely stay in the middle of the pack and throws up at the end. That's prob the only test she should have an advantage in. She's underweight but must have stamina from working in those conditions for a year. So she should be good at going a long distance of running. All those super muscley men should have it harder to lug their muscles for a long time. All long distance runners are lean as hell. I felt like there wasn't a lot of research in the book. </spoiler> <br/><br/>Despite my critiques, the book was still pretty enjoyable to read and that's why I gave it 3 stars. I still had a good time reading it and I want to continue with the series. <br/><br/>Another thing though, <spoiler> the romance with Dorian was like so weird? Like it was kinda insta lust because they never really spent time together. Though I liked him and was upset when she just broke things off with him at the end. And for what? Her reasons didn't make a lot of sense. But I suppose in order to have a love triangle they have to give Chaol a fighting shot in the next book. </spoiler> <br/><br/>Also, I really liked Nox's character I'm sad that he left he was pretty cool and I wish we could learn more about him.",,,1,0,,No ISBN
